{
  "$schema": "http://json-schema.org/draft-07/schema#",
  "$id": "mailto:phlogistonjohn+sambacc-v0@asynchrono.us",
  "title": "sambacc configuration",
  "description": "The configuration for the sambacc tool. sambacc configures Samba and the container\nenvironment to fit Samba's unique needs. This configuration can hold configuration\nfor more than one server \"instance\". The \"configs\" section contains one or more\nconfiguration with a name that can be selected at runtime. Share definitions\nand samba global configuration blocks can be mixed and matched.\n",
  "type": "object",
  "$defs": {
    "section_choices": {
      "description": "Selects sub-sections from elsewhere in the configuration.\n",
      "type": "array",
      "items": {
        "type": "string"
      }
    },
    "feature_flags": {
      "description": "Feature flags are used to enable specific, wide-ranging, features of\nsambacc. For example, it is used to enable clustered mode with ctdb.\n",
      "type": "array",
      "items": {
        "enum": [
          "addc",
          "ctdb"
        ]
      }
    },
    "samba_options": {
      "description": "A mapping of values that will be passed into the smb.conf (or equivalent)\nto directly configure Samba.\n",
      "type": "object",
      "additionalProperties": {
        "type": "string"
      }
    },
    "share_meta_config": {
      "description": "Metadata about a share's storage.\n",
      "type": "object",
      "properties": {
        "origin": {
          "description": "The kind of storage the share is based on. \"local\" storage should\nbe set up on every CTDB cluster node; \"shared\" storage (the\ndefault) only needs setup on the cluster leader; \"virtual\" storage\nis not accessible via POSIX apis.\n",
          "type": "string",
          "enum": [
            "unknown",
            "local",
            "shared",
            "virtual"
          ]
        }
      },
      "additionalProperties": false
    },
    "permissions_config": {
      "description": "Settings that enable and manage sambacc's permissions management support.\n",
      "type": "object",
      "properties": {
        "method": {
          "description": "Backend method for controlling permissions on shares",
          "type": "string"
        },
        "status_xattr": {
          "description": "xattr name used to store permissions state",
          "type": "string"
        }
      },
      "additionalProperties": {
        "type": "string"
      }
    },
    "user_entry": {
      "description": "A user that will be instantiated in the local container environment to\nin order to provide access to smb shares.\n",
      "type": "object",
      "properties": {
        "name": {
          "description": "The user's name",
          "type": "string"
        },
        "uid": {
          "description": "The Unix UID the user should have",
          "type": "integer"
        },
        "gid": {
          "description": "The Unix GID the user should have",
          "type": "integer"
        },
        "nt_hash": {
          "description": "An NT-Hashed password",
          "type": "string"
        },
        "password": {
          "description": "A plain-text password",
          "type": "string"
        }
      },
      "required": [
        "name"
      ],
      "additionalProperties": false
    },
    "group_entry": {
      "description": "A group that will be instantiated in the local container environment to\nin order to provide access to smb shares.\n",
      "type": "object",
      "properties": {
        "name": {
          "description": "The group name",
          "type": "string"
        },
        "gid": {
          "description": "The Unix GID the group should have",
          "type": "integer"
        },
        "members": {
          "description": "List of usernames that belong to this group",
          "type": "array",
          "items": {
            "type": "string"
          }
        }
      },
      "required": [
        "name"
      ],
      "additionalProperties": false
    },
    "domain_user_entry": {
      "description": "A user that will be created in the specified AD domain. These\nusers are populated in the directory after the domain is provisioned.\n",
      "type": "object",
      "properties": {
        "name": {
          "description": "The user's name",
          "type": "string"
        },
        "surname": {
          "description": "A surname for the user",
          "type": "string"
        },
        "given_name": {
          "description": "A given name for the user",
          "type": "string"
        },
        "uid": {
          "type": "integer"
        },
        "gid": {
          "type": "integer"
        },
        "nt_hash": {
          "type": "string"
        },
        "password": {
          "description": "A plain-text password",
          "type": "string"
        },
        "ou": {
          "description": "A organizational unit that the user should belong to",
          "type": "string"
        },
        "member_of": {
          "description": "A list of group names that the user should belong to",
          "type": "array",
          "items": {
            "type": "string"
          }
        }
      },
      "required": [
        "name"
      ],
      "additionalProperties": false
    },
    "domain_group_entry": {
      "description": "A group that will be created in the specified AD domain. These\ngroups are populated in the directory after the domain is provisioned.\n",
      "type": "object",
      "properties": {
        "name": {
          "description": "The group name",
          "type": "string"
        },
        "gid": {
          "type": "integer"
        },
        "ou": {
          "description": "A organizational unit that the user should belong to",
          "type": "string"
        }
      },
      "required": [
        "name"
      ],
      "additionalProperties": false
    },
    "organizational_unit_entry": {
      "description": "A organizational unit that will be created in the specified AD domain. These\ngroups are populated in the directory after the domain is provisioned.\n",
      "type": "object",
      "properties": {
        "name": {
          "description": "The organizational unit name",
          "type": "string"
        }
      },
      "required": [
        "name"
      ],
      "additionalProperties": false
    }
  },
  "properties": {
    "samba-container-config": {
      "type": "string",
      "title": "Configuration Format Version",
      "description": "A short version string that assists in allowing the configuration\nformat to (some day) support incompatible version changes.\n(It is unique to the configuration and is not the version of sambacc)\n"
    },
    "configs": {
      "title": "Container Configurations",
      "description": "A mapping of named configurations (instances) to top-level configuration\nblocks. A usable configuration file must have at least one configuration,\nbut more than one is supported.\n",
      "type": "object",
      "additionalProperties": {
        "type": "object",
        "properties": {
          "shares": {
            "$ref": "#/$defs/section_choices"
          },
          "globals": {
            "$ref": "#/$defs/section_choices"
          },
          "instance_features": {
            "$ref": "#/$defs/feature_flags"
          },
          "permissions": {
            "$ref": "#/$defs/permissions_config"
          },
          "sharemeta": {
            "$ref": "#/$defs/share_meta_config"
          },
          "instance_name": {
            "description": "A name that will be set for the server instance.\n",
            "type": "string"
          },
          "domain_settings": {
            "description": "The name of the domain settings. Only used with 'ADDC' feature flag.\n",
            "type": "string"
          }
        },
        "additionalProperties": false
      }
    },
    "shares": {
      "description": "A mapping of share name to share specific configuration. A share can\nhave \"options\" that are passed to Samba. Shares can have an optional\n\"permissions\" section for managing permissions/acls in sambacc.\n",
      "type": "object",
      "additionalProperties": {
        "type": "object",
        "properties": {
          "options": {
            "$ref": "#/$defs/samba_options"
          },
          "permissions": {
            "$ref": "#/$defs/permissions_config"
          },
          "meta": {
            "$ref": "#/$defs/share_meta_config"
          }
        },
        "additionalProperties": false
      }
    },
    "globals": {
      "description": "A mapping of samba global configuration blocks. The global section names\nare not passed to Samba. All sections selected by a configuration are\nmerged together before passing to Samba.\n",
      "type": "object",
      "additionalProperties": {
        "type": "object",
        "properties": {
          "options": {
            "$ref": "#/$defs/samba_options"
          }
        },
        "additionalProperties": false
      }
    },
    "domain_settings": {
      "description": "A mapping of AD DC domain configuration keys to domain configurations.\nThese parameters are used when provisioning an AD DC instance.\n",
      "type": "object",
      "additionalProperties": {
        "type": "object",
        "properties": {
          "realm": {
            "type": "string"
          },
          "short_domain": {
            "type": "string"
          },
          "admin_password": {
            "description": "The administrator password for the AD DC domain.\nCan be specified as a plain string, or as an object to source\nthe password from a file or environment variable.\n",
            "oneOf": [
              {
                "type": "string"
              },
              {
                "type": "object",
                "properties": {
                  "file": {
                    "type": "string",
                    "description": "Path to a file containing the admin password."
                  },
                  "env": {
                    "type": "string",
                    "description": "Name of an environment variable containing the admin password."
                  }
                },
                "additionalProperties": false
              }
            ]
          },
          "interfaces": {
            "type": "object",
            "properties": {
              "include_pattern": {
                "type": "string",
                "description": "A regular expression that must match for a network interface\nto be included in the AD DC interfaces list.\n"
              },
              "exclude_pattern": {
                "type": "string",
                "description": "A regular expression that must not match for a network interface\nto be included in the AD DC interfaces list.\n"
              }
            }
          }
        },
        "required": [
          "realm"
        ],
        "additionalProperties": false
      }
    },
    "users": {
      "description": "Users to add to the container environment in order to provide\nShare access-control without becoming a domain member server.\n",
      "type": "object",
      "properties": {
        "all_entries": {
          "type": "array",
          "items": {
            "$ref": "#/$defs/user_entry"
          }
        }
      }
    },
    "groups": {
      "description": "Groups to add to the container environment in order to provide\nShare access-control without becoming a domain member server.\n",
      "type": "object",
      "properties": {
        "all_entries": {
          "type": "array",
          "items": {
            "$ref": "#/$defs/group_entry"
          }
        }
      }
    },
    "domain_users": {
      "description": "The domain_users section defines initial users that will be automatically\nadded to a newly provisioned domain. This section is a mapping of the\ndomain settings name to a list of domain user entries.\n",
      "type": "object",
      "additionalProperties": {
        "type": "array",
        "items": {
          "$ref": "#/$defs/domain_user_entry"
        }
      }
    },
    "domain_groups": {
      "description": "The domain_groups section defines initial groups that will be\nautomatically added to a newly provisioned domain. This section is\na mapping of the domain settings name to a list of domain group entries.\n",
      "type": "object",
      "additionalProperties": {
        "type": "array",
        "items": {
          "$ref": "#/$defs/domain_group_entry"
        }
      }
    },
    "organizational_units": {
      "description": "The organizational_unit section defines initial organizational unit that will be\nautomatically added to a newly provisioned domain. This section is\na mapping of the domain settings name to a list of domain group entries.\n",
      "type": "object",
      "additionalProperties": {
        "type": "array",
        "items": {
          "$ref": "#/$defs/organizational_unit_entry"
        }
      }
    },
    "ctdb": {
      "type": "object",
      "additionalProperties": {
        "type": "string"
      }
    },
    "config:merge": {
      "type": "object",
      "properties": {
        "configs": {
          "$ref": "#/properties/configs"
        },
        "shares": {
          "$ref": "#/properties/shares"
        },
        "globals": {
          "$ref": "#/properties/globals"
        },
        "domain_settings": {
          "$ref": "#/properties/domain_settings"
        },
        "users": {
          "$ref": "#/properties/users"
        },
        "groups": {
          "$ref": "#/properties/groups"
        },
        "domain_users": {
          "$ref": "#/properties/domain_users"
        },
        "domain_groups": {
          "$ref": "#/properties/domain_groups"
        },
        "organizational_units": {
          "$ref": "#/properties/organizational_units"
        },
        "ctdb": {
          "$ref": "#/properties/ctdb"
        }
      }
    }
  },
  "additionalProperties": false,
  "required": [
    "samba-container-config"
  ],
  "patternProperties": {
    "^_": true
  }
}