{
  "samba-container-config": "v0",
  "configs": {
    "demo": {
      "instance_features": ["addc"],
      "domain_settings": "sink",
      "instance_name": "dc1"
    }
  },
  "domain_settings": {
    "sink": {
      "realm": "DOMAIN1.SINK.TEST",
      "short_domain": "DOMAIN1",
      "admin_password": {"env": "ADMIN_PASSWORD"}
    }
  },
  "domain_groups": {
    "sink": [
        {"name": "supervisors"},
        {"name": "employees"}
    ]
  },
  "domain_users": {
    "sink": [
      {
        "name": "bwayne",
        "password": "1115Rose.",
        "given_name": "Bruce",
        "surname": "Wayne",
        "member_of": ["supervisors", "employees"]
      }
    ]
  }
}
